{
  "schemaVersion": "HostLeverCatalogV1",
  "catalogVersion": "1.0.0",
  "sourceMatrixRef": {
    "path": "scripts/lib/always-on-governance.js#buildHostAdapterCompatibilityMatrix",
    "schemaVersion": "HostAdapterCompatibilityMatrixV1",
    "matrixId": "always-on-host-e658c8136dbff462141296a05bfbe2d1be3c38344283e4556477964ebeeba963",
    "sourceHead": "ef60b2b593a232747880b86316bec6f888c7cd89"
  },
  "entries": [
    {
      "hostId": "copilot",
      "hostSurfaceOrVariant": "copilot-vscode",
      "capabilityFamilyId": "planning",
      "leverVersion": "1.0.0",
      "leverType": "agent-mode",
      "invocation": "user-selects-plan-agent; runtime invocation not wired in Phase 1",
      "automationAuthority": "host-user-action",
      "eligibility": {
        "status": "phase2-candidate",
        "prerequisites": [
          "exact VS Code Copilot surface",
          "direct lifecycle replay",
          "explicit user authority"
        ],
        "requiredEvidence": [
          "official Plan agent documentation",
          "direct enter/approve/cancel/exit replay"
        ],
        "requiresExplicitUserAuthority": true
      },
      "evidence": {
        "evidenceStatus": "PASS",
        "evidenceRef": [
          "HostAdapterCompatibilityMatrixV1#copilot-vscode",
          "GitHub Copilot Plan mode official documentation checked 2026-07-24"
        ],
        "evidenceCheckedAt": "2026-07-23T23:00:27Z",
        "evidenceLease": {
          "kind": "official-docs",
          "duration": "P30D",
          "sourceHead": null
        }
      },
      "permission": {
        "permissionDelta": "none",
        "writeBoundary": "Plan agent selection does not grant DevCodex mutation authority or bypass CP."
      },
      "lifecycle": {
        "enter": {
          "owner": "user/host",
          "observable": false,
          "evidenceRef": "official documentation only; no DevCodex direct replay"
        },
        "approve": {
          "owner": "user",
          "observable": false,
          "evidenceRef": "host UI approval is not a DevCodex CP receipt"
        },
        "cancel": {
          "owner": "user/host",
          "observable": false,
          "evidenceRef": "direct cancellation replay required"
        },
        "exit": {
          "owner": "user/host",
          "observable": false,
          "evidenceRef": "direct exit replay required"
        }
      },
      "fallback": {
        "portableDecision": "plan_first",
        "reasonCode": "NATIVE_NOT_PHASE1",
        "retryable": false
      },
      "validation": {
        "negativeProbe": [
          "do not claim Plan agent was selected from repository instructions",
          "do not treat host approval as CP confirmation"
        ],
        "runtimeOwner": "future/copilot-vscode-native-adapter",
        "validationOwner": "host-capability-routing"
      },
      "freshness": {
        "invalidationTriggers": [
          "schema",
          "source",
          "host",
          "protocol",
          "evidence",
          "consumer",
          "runtime-owner"
        ]
      }
    },
    {
      "hostId": "copilot",
      "hostSurfaceOrVariant": "copilot-jetbrains",
      "capabilityFamilyId": "planning",
      "leverVersion": "1.0.0",
      "leverType": "agent-mode",
      "invocation": "preview surface documented; runtime invocation not wired in Phase 1",
      "automationAuthority": "host-user-action",
      "eligibility": {
        "status": "portable-only",
        "prerequisites": [
          "exact JetBrains Copilot surface",
          "stable non-preview contract",
          "direct lifecycle replay"
        ],
        "requiredEvidence": [
          "version-specific official documentation",
          "direct enter/approve/cancel/exit replay"
        ],
        "requiresExplicitUserAuthority": true
      },
      "evidence": {
        "evidenceStatus": "WARN",
        "evidenceRef": [
          "HostAdapterCompatibilityMatrixV1#copilot-jetbrains",
          "Copilot JetBrains native planning remains preview/documentation-backed"
        ],
        "evidenceCheckedAt": "2026-07-23T23:00:27Z",
        "evidenceLease": {
          "kind": "official-docs",
          "duration": "P30D",
          "sourceHead": null
        }
      },
      "permission": {
        "permissionDelta": "unknown",
        "writeBoundary": "Preview host behavior cannot authorize mutation or lower DevCodex confirmation levels."
      },
      "lifecycle": {
        "enter": {
          "owner": "user/host",
          "observable": false,
          "evidenceRef": "preview documentation is insufficient for direct invocation"
        },
        "approve": {
          "owner": "user",
          "observable": false,
          "evidenceRef": "host approval remains separate from CP"
        },
        "cancel": {
          "owner": "user/host",
          "observable": false,
          "evidenceRef": "direct cancellation replay absent"
        },
        "exit": {
          "owner": "user/host",
          "observable": false,
          "evidenceRef": "direct exit replay absent"
        }
      },
      "fallback": {
        "portableDecision": "plan_first",
        "reasonCode": "NATIVE_EVIDENCE_UNVERIFIED",
        "retryable": false
      },
      "validation": {
        "negativeProbe": [
          "do not borrow VS Code evidence for JetBrains",
          "do not upgrade preview documentation to direct replay"
        ],
        "runtimeOwner": "future/copilot-jetbrains-native-adapter",
        "validationOwner": "host-capability-routing"
      },
      "freshness": {
        "invalidationTriggers": [
          "schema",
          "source",
          "host",
          "protocol",
          "evidence",
          "consumer",
          "runtime-owner"
        ]
      }
    },
    {
      "hostId": "claude",
      "hostSurfaceOrVariant": "claude-code",
      "capabilityFamilyId": "planning",
      "leverVersion": "1.0.0",
      "leverType": "permission-mode",
      "invocation": "/plan or Shift+Tab behavior documented; runtime invocation not wired in Phase 1",
      "automationAuthority": "host-user-action",
      "eligibility": {
        "status": "phase2-candidate",
        "prerequisites": [
          "Claude Code runtime",
          "permission and lifecycle direct replay",
          "explicit user authority"
        ],
        "requiredEvidence": [
          "official permission-mode documentation",
          "direct enter/approve/cancel/exit replay",
          "shell and subagent negative replay"
        ],
        "requiresExplicitUserAuthority": true
      },
      "evidence": {
        "evidenceStatus": "PASS",
        "evidenceRef": [
          "HostAdapterCompatibilityMatrixV1#claude-code",
          "Anthropic permission-mode official documentation checked 2026-07-24"
        ],
        "evidenceCheckedAt": "2026-07-23T23:00:27Z",
        "evidenceLease": {
          "kind": "official-docs",
          "duration": "P30D",
          "sourceHead": null
        }
      },
      "permission": {
        "permissionDelta": "unknown",
        "writeBoundary": "Permission mode does not replace DevCodex CP or prove shell/subagent mutation is blocked."
      },
      "lifecycle": {
        "enter": {
          "owner": "user/host",
          "observable": false,
          "evidenceRef": "official command exists; DevCodex direct replay absent"
        },
        "approve": {
          "owner": "user",
          "observable": false,
          "evidenceRef": "host approval cannot stand in for CP"
        },
        "cancel": {
          "owner": "user/host",
          "observable": false,
          "evidenceRef": "direct cancellation replay absent"
        },
        "exit": {
          "owner": "user/host",
          "observable": false,
          "evidenceRef": "direct exit replay absent"
        }
      },
      "fallback": {
        "portableDecision": "plan_first",
        "reasonCode": "NATIVE_NOT_PHASE1",
        "retryable": false
      },
      "validation": {
        "negativeProbe": [
          "permission mode must not bypass CP",
          "shell/subagent authority must remain independently bounded"
        ],
        "runtimeOwner": "future/claude-code-native-adapter",
        "validationOwner": "host-capability-routing"
      },
      "freshness": {
        "invalidationTriggers": [
          "schema",
          "source",
          "host",
          "protocol",
          "evidence",
          "consumer",
          "runtime-owner"
        ]
      }
    },
    {
      "hostId": "codex",
      "hostSurfaceOrVariant": "codex",
      "capabilityFamilyId": "planning",
      "leverVersion": "1.0.0",
      "leverType": "native-plan",
      "invocation": "/plan is unavailable during active task work; runtime invocation not wired in Phase 1",
      "automationAuthority": "host-user-action",
      "eligibility": {
        "status": "phase2-candidate",
        "prerequisites": [
          "Codex runtime outside incompatible active-task state",
          "direct lifecycle replay",
          "explicit user authority"
        ],
        "requiredEvidence": [
          "official developer-command documentation",
          "current runtime invocation authority",
          "direct enter/approve/cancel/exit replay"
        ],
        "requiresExplicitUserAuthority": true
      },
      "evidence": {
        "evidenceStatus": "PASS",
        "evidenceRef": [
          "HostAdapterCompatibilityMatrixV1#codex",
          "OpenAI Codex developer-command documentation checked 2026-07-24"
        ],
        "evidenceCheckedAt": "2026-07-23T23:00:27Z",
        "evidenceLease": {
          "kind": "official-docs",
          "duration": "P30D",
          "sourceHead": null
        }
      },
      "permission": {
        "permissionDelta": "none",
        "writeBoundary": "A native plan surface does not alter sandbox, approval policy, CP, or task authority."
      },